{
  "$schema": "../schema/dashboard.schema.json",
  "version": 1,
  "key": "founder-pulse",
  "name": "Founder Pulse",
  "description": "WF-60 growth-funnel overview for founder/on-call. Aggregates DAU/WAU/MAU, signup→onboarding→first_action activation funnel (overall + per module), MRR / new-subscriptions, D1/D7/D30 retention and activation rate from the canonical events declared in packages/shared/src/lib/analyticsEvents.ts. Runbook: docs/operations/observability/posthog-founder-pulse.md.",
  "description_uk": "Зведений growth-пульс продукту для засновника: активні користувачі, воронка активації (загальна + по модулях), рівень активації, нові підписки/MRR, утримання D1/D7/D30 і канарка нулів. На ранній стадії дані рідкі — панелі оживуть із трафіком. У кожної панелі є опис (наведи курсор на ℹ️), що вона означає, як читати й до якого числа прагнемо.",
  "timezone": "Europe/Kyiv",
  "events_contract": {
    "signup_completed": {
      "payload": { "method": "email | google" },
      "fired_by": "apps/web/src/core/auth/AuthContext.tsx",
      "introduced_by": "PR-06 (#1983)"
    },
    "onboarding_completed": {
      "payload": {
        "intent": "preset_picker",
        "picksCount": "number"
      },
      "fired_by": "apps/web/src/core/app/WelcomeScreen.tsx completeOnboarding()",
      "idempotency": "hub_onboarding_completed_v1 KV flag (once per account)",
      "introduced_by": "PR-07 (#2566)"
    },
    "first_action_completed": {
      "payload": { "module": "finyk | fizruk | routine | nutrition" },
      "fired_by": "packages/shared/src/lib/firstRealEntry.ts detectFirstActionCompletedPerModule",
      "idempotency": "hub_first_action_completed_v1:<module> KV flag (once per module per account)",
      "introduced_by": "PR-08 (#2025)"
    },
    "subscription_started": {
      "payload": {
        "plan": "string",
        "cadence": "monthly | yearly",
        "source": "stripe_webhook",
        "status": "string",
        "price_cents": "number",
        "currency": "string",
        "$revenue": "number (major units, e.g. 7 for $7)",
        "stripe_event_id": "string",
        "stripe_subscription_id": "string"
      },
      "fired_by": "apps/server/src/modules/billing/stripe.ts",
      "idempotency": "uuid = event.id (PostHog dedupe) + stripe_webhook_events.event_id (DB)",
      "introduced_by": "PR-09 (#2525)"
    }
  },
  "super_properties": ["platform", "is_capacitor", "environment"],
  "person_properties": ["vibe", "plan", "locale", "signup_date"],
  "panels": [
    {
      "key": "active-users",
      "name": "Active users — DAU / WAU / MAU",
      "name_uk": "Активні користувачі — DAU / WAU / MAU",
      "description_uk": "Скільки унікальних людей користувалися застосунком за день (DAU), тиждень (WAU) і місяць (MAU). Головний пульс продукту. Ціль: DAU росте тиждень-до-тижня; «липкість» WAU/DAU ≥ 0.35.",
      "type": "trends",
      "size": "wide",
      "description": "Rolling unique-user counts over yesterday-anchored 1d / 7d / 30d windows. Cohort is `any event in window`, not just `$pageview`, so backend-only events (Stripe webhook → `subscription_started`) still count the user as active.",
      "rationale": "DAU/WAU/MAU is the load-bearing health signal for the product. WAU/DAU ratio (stickiness) and MAU month-over-month trajectory live downstream of this panel.",
      "targets": {
        "DAU": "growth ≥0 WoW",
        "WAU/DAU stickiness": "≥0.35 (P2 below)",
        "MAU MoM growth": "≥5% / month (P2 below; P1 if negative two months in a row)"
      },
      "query": {
        "kind": "HogQLQuery",
        "query": "SELECT 'DAU' AS metric, uniq(distinct_id) AS users FROM events WHERE timestamp >= toStartOfDay(now() - INTERVAL 1 DAY) AND timestamp < toStartOfDay(now()) UNION ALL SELECT 'WAU' AS metric, uniq(distinct_id) AS users FROM events WHERE timestamp >= toStartOfDay(now() - INTERVAL 7 DAY) AND timestamp < toStartOfDay(now()) UNION ALL SELECT 'MAU' AS metric, uniq(distinct_id) AS users FROM events WHERE timestamp >= toStartOfDay(now() - INTERVAL 30 DAY) AND timestamp < toStartOfDay(now())"
      },
      "breakdown": {
        "type": "super_property",
        "key": "platform",
        "comment": "Web vs ios vs android via the platform super-property registered in apps/web/src/core/observability/posthog.ts."
      }
    },
    {
      "key": "wf60-funnel-overall",
      "name": "WF-60 activation funnel — signup → onboarding → first_action",
      "name_uk": "Воронка активації: реєстрація → онбординг → перша дія → підписка",
      "description_uk": "Скільки нових користувачів проходять увесь шлях до активації за 7 днів. Один графік відповідає на питання «чи стають реєстрації активними користувачами?». Ціль: реєстрація→онбординг ≥ 70%, онбординг→перша дія ≥ 60%.",
      "type": "funnel",
      "size": "wide",
      "description": "Strict-sequence funnel over the four canonical activation milestones. Conversion window: 7 days from signup. Time range: last 28 days. Use to spot WoW regressions in any single step.",
      "rationale": "PR-06/07/08/09 wire these events. The funnel here is the single chart that compresses 'are new sign-ups becoming activated users?' into one number. Cross-references the server-side growth-funnel snapshot timer (ADR-0089, formerly n8n WF-60) which snapshots the same four steps daily.",
      "targets": {
        "signup → onboarding": "≥70% within 24h (P2 below 50%, P1 below 30%)",
        "onboarding → first_action": "≥60% within 7 days (P2 below 40%, P1 below 20%)",
        "first_action → subscription": "≥3% within 30 days (baseline TBD post-paywall)"
      },
      "steps": [
        { "event": "signup_completed" },
        { "event": "onboarding_completed" },
        { "event": "first_action_completed" },
        { "event": "subscription_started" }
      ],
      "conversion_window": { "hours": 168 },
      "breakdown": {
        "type": "person_property",
        "key": "vibe",
        "comment": "Person-property `vibe` is an array of module picks. PostHog flattens — each user contributes once per pick. Off-diagonal funnel mass spots vibe-blind onboarding."
      }
    },
    {
      "key": "wf60-funnel-per-module",
      "name": "WF-60 activation funnel per module",
      "name_uk": "Воронка активації по модулях",
      "description_uk": "Та сама воронка, але розбита по модулях (фінік / фізрук / рутина / харчування) — видно, де люди реально роблять першу дію. Якщо один модуль ловить >70%, а інший <10% — рекомендації онбордингу перекошені.",
      "type": "funnel",
      "size": "wide",
      "description": "Same funnel as `wf60-funnel-overall` but breaks down step 3 (`first_action_completed`) by the event-payload `module` field. Returns four funnels — one per Hub module (finyk, fizruk, routine, nutrition).",
      "rationale": "Audit failure mode: a user picks `finyk` in onboarding but the first real action is logged in `nutrition`. Module-bucketed funnel quantifies that misalignment per module so module-specific FTUX fixes (PR-08 `markFirstActionCompletedForModule`) can be triaged on data, not guesses.",
      "targets": {
        "per-module signup → first_action": "Each of finyk/fizruk/routine/nutrition ≥40% within 7 days (P2 below)",
        "module skew": "If any single module captures >70% of first_actions and another <10%, the onboarding recommendation engine is leaking — file Linear ticket."
      },
      "steps": [
        { "event": "signup_completed" },
        { "event": "onboarding_completed" },
        {
          "event": "first_action_completed",
          "breakdown": "properties.module",
          "module_values": ["finyk", "fizruk", "routine", "nutrition"]
        }
      ],
      "conversion_window": { "hours": 168 }
    },
    {
      "key": "activation-rate",
      "name": "Activation rate (D1)",
      "name_uk": "Рівень активації (D1)",
      "description_uk": "Частка користувачів, що зробили першу реальну дію протягом 24 год після реєстрації. Стискає всю воронку в одне число — чи виконана обіцянка продукту на першій сесії. Ціль: ≥ 30%; падіння на ≥ 10 п.п. за тиждень — тривога.",
      "type": "hogql",
      "size": "narrow",
      "description": "Share of users who completed any `first_action_completed` event within 24h of `signup_completed`. Computed daily for the last 28 days and plotted as a line — the curve is the canary for onboarding regressions.",
      "rationale": "Activation rate compresses the funnel into a single percentage. Crossing the D1 boundary is the textbook signal that the FTUX promise was kept on session-1. Below, the AARRR funnel collapses regardless of upstream signup volume.",
      "targets": {
        "D1 activation": "≥30% (P2 below 20%, P1 below 10%)",
        "regression alert": "drops ≥10pp WoW → P1 (page on-call; likely deploy regression in `first_action_completed` instrumentation or KV-flag namespace drift)"
      },
      "query": {
        "kind": "HogQLQuery",
        "query": "WITH signups AS (SELECT distinct_id, min(timestamp) AS signed_at FROM events WHERE event = 'signup_completed' AND timestamp >= now() - INTERVAL 28 DAY GROUP BY distinct_id), first_actions AS (SELECT distinct_id, min(timestamp) AS acted_at FROM events WHERE event = 'first_action_completed' GROUP BY distinct_id) SELECT toDate(s.signed_at) AS cohort_day, count() AS signups, countIf(fa.acted_at IS NOT NULL AND fa.acted_at <= s.signed_at + INTERVAL 1 DAY) AS activated, round(activated * 1.0 / signups, 4) AS d1_activation_rate FROM signups s LEFT JOIN first_actions fa ON s.distinct_id = fa.distinct_id GROUP BY cohort_day ORDER BY cohort_day"
      }
    },
    {
      "key": "new-subscriptions",
      "name": "New subscriptions — count + new MRR",
      "name_uk": "Нові підписки + новий MRR",